profile_id,display_name,min_service_fee_low,min_service_fee_typ,min_service_fee_high,per_cy_fee_low,per_cy_fee_typ,per_cy_fee_high,minimum_billable_volume_cy,truck_capacity_cy,billing_increment_fraction,dense_material_threshold_ton_per_cy,dense_material_multiplier_low,dense_material_multiplier_typ,dense_material_multiplier_high,data_quality,source,source_url,source_version_date,notes
national_baseline_2026,US homeowner baseline (junk removal),120,180,260,26,40,62,2.0,15.0,0.125,0.35,1.05,1.20,1.38,medium,ANGI+FORBES_HOME+1800_GOT_JUNK,https://www.angi.com/articles/how-much-does-junk-removal-cost.htm|https://www.forbes.com/home-improvement/moving-services/junk-removal-cost/|https://www.1800gotjunk.com/us_en/how-our-pricing-works,2026-03-04,"Blended baseline for homeowner one-off cleanout; pricing rounded to support range output."
fast_turn_urban_2026,Urban fast-turn premium,160,240,340,32,48,70,2.0,15.0,0.125,0.35,1.08,1.25,1.45,medium,FORBES_HOME+HOMEGUIDE+1800_GOT_JUNK,https://www.forbes.com/home-improvement/moving-services/junk-removal-cost/|https://homeguide.com/costs/junk-removal-prices|https://www.1800gotjunk.com/us_en/how-our-pricing-works,2026-03-04,"Higher labor and dispatch volatility profile for urgent metro demand."
value_suburban_2026,Suburban value route,90,140,210,20,33,52,2.0,15.0,0.125,0.35,1.03,1.15,1.30,medium,HOMEGUIDE+ANGI+JUNK_KING,https://homeguide.com/costs/junk-removal-prices|https://www.angi.com/articles/how-much-does-junk-removal-cost.htm|https://www.junk-king.com/pricing/,2026-03-04,"Cost-sensitive baseline for non-urgent residential jobs with easy truck access."
coastal_premium_2026,Coastal logistics premium,145,215,310,30,45,68,2.0,15.0,0.125,0.35,1.07,1.24,1.42,medium,FORBES_HOME+HOMEGUIDE+ANGI,https://www.forbes.com/home-improvement/moving-services/junk-removal-cost/|https://homeguide.com/costs/junk-removal-prices|https://www.angi.com/articles/how-much-does-junk-removal-cost.htm,2026-03-04,"Higher labor, parking, and dispatch volatility in coastal metros/suburbs."
mountain_sparse_2026,Mountain sparse-dispatch profile,130,195,290,24,38,58,2.0,15.0,0.125,0.35,1.06,1.22,1.40,medium,ANGI+FORBES_HOME+JUNK_KING,https://www.angi.com/articles/how-much-does-junk-removal-cost.htm|https://www.forbes.com/home-improvement/moving-services/junk-removal-cost/|https://www.junk-king.com/pricing/,2026-03-04,"Longer deadhead and truck-time overhead for lower-density mountain service areas."
heartland_balanced_2026,Heartland balanced profile,105,160,240,22,36,56,2.0,15.0,0.125,0.35,1.04,1.17,1.33,medium,HOMEGUIDE+ANGI+FORBES_HOME,https://homeguide.com/costs/junk-removal-prices|https://www.angi.com/articles/how-much-does-junk-removal-cost.htm|https://www.forbes.com/home-improvement/moving-services/junk-removal-cost/,2026-03-04,"Mid-continent baseline between national and value tiers for typical homeowner cleanouts."
